{"organizations": [], "uuid": "e1d43f24099791ce70085bb3958122f089c04849", "thread": {"social": {"gplus": {"shares": 0}, "pinterest": {"shares": 0}, "vk": {"shares": 0}, "linkedin": {"shares": 0}, "facebook": {"likes": 0, "shares": 0, "comments": 0}, "stumbledupon": {"shares": 0}}, "site_full": "buyiptvblog.wordpress.com", "main_image": "", "site_section": "https://buyiptvblog.wordpress.com", "section_title": "IPTV 12 MONTHS SUBSCRIPTION PLATINUM PACKAGE +1 MONTH FREE [2DEVICES] â€“ buy-iptv.com", "url": "https://buyiptvblog.wordpress.com/2017/03/04/iptv-12-months-subscription-platinum-package-1-month-free-2devices-45", "country": "US", "title": "IPTV 12 MONTHS SUBSCRIPTION PLATINUM PACKAGE +1 MONTH FREE [2DEVICES]", "performance_score": 0, "site": "wordpress.com", "participants_count": 1, "title_full": "IPTV 12 MONTHS SUBSCRIPTION PLATINUM PACKAGE +1 MONTH FREE [2DEVICES]", "spam_score": 0.0, "site_type": "blogs", "published": "2017-03-04T19:30:00.000+02:00", "replies_count": 0, "uuid": "e1d43f24099791ce70085bb3958122f089c04849"}, "author": "buy-iptv.com", "url": "https://buyiptvblog.wordpress.com/2017/03/04/iptv-12-months-subscription-platinum-package-1-month-free-2devices-45", "ord_in_thread": 0, "title": "IPTV 12 MONTHS SUBSCRIPTION PLATINUM PACKAGE +1 MONTH FREE [2DEVICES]", "locations": [], "entities": {"persons": [{"name": "kodi", "sentiment": "none"}], "locations": [{"name": "portugal", "sentiment": "none"}, {"name": "serbia", "sentiment": "none"}, {"name": "greece", "sentiment": "none"}, {"name": "lebanon", "sentiment": "none"}, {"name": "africa", "sentiment": "none"}, {"name": "uk", "sentiment": "none"}, {"name": "tunisia", "sentiment": "none"}, {"name": "netherlands", "sentiment": "none"}, {"name": "germany", "sentiment": "none"}, {"name": "algeria", "sentiment": "none"}, {"name": "italy", "sentiment": "none"}, {"name": "sweden", "sentiment": "none"}], "organizations": [{"name": "box office", "sentiment": "none"}, {"name": "vlc", "sentiment": "none"}, {"name": "samsung/lg tv", "sentiment": "none"}, {"name": "apple", "sentiment": "none"}]}, "highlightText": "", "language": "english", "persons": [], "text": "Buy IPTV Platinum 12 Months Subscription +1 MONTH FREE [2DEVICES]. https://www.buy-iptv.com/product/iptv-12-months-subscription-platinum-package-1year-free/ \nDelivery time: We sent code and instructions in your order message within 5min Lifetime Support Warranty 100% Secure Ordering Process Stable and Reliable IPTV Packages Support is Gorgeous, Really 7 days per week the largest IPTV Server in the world Support All Devices Instant Online Delivery support : Android M3U/VLC,Mag25x,Kodi(XBMC),Enigma2,Samsung/LG TV,iPhone&iPad \n12+1 Months subscription giving you access 2 device each device 1 year and 1 month , more then 1800 plus channel for free,The SKY Italy,sky UK ,skyDE is VIP channel .other channel is Additional Channel!\nInclude Package: Sky it ,SKy UK ,Germany ,Turkish , Serbia,Indian, French,Greece, Sweden, Netherlands,Portugal, Spanish Arabic .\nOur Platinum iptv Package works on all inform MAG Set-top boxes, Android and\nAVOV Set-top boxes and Kodi (XBMC) IPTV Stalker. includes thousands of\nvideo on demand movies in HD*, hundreds of international channels in HD*\nIt has more than 1800 channels, including French, Arabic, Tunisia, Algeria, Lebanon, Box Office, and Africa channels, etc.\nIt can work with Android device, Mag250, Mag254, XBMC KODI, Enigma2 Linux, Apple device and M3U VLC Player\n \nChannels list agreement \n(below channels are for normal reference only ,not the final one )\nImportant Notice ,channels lists keep adding and updating according to buyer feedback and server stability needs,\nwe will add some channels according to market needs ,and delete some channels if its not stable .\n \n\nvia WordPress https://buyiptvblog.wordpress.com/2017/03/04/iptv-12-months-subscription-platinum-package-1-month-free-2devices/ \n\nvia WordPress https://buyiptvblog.wordpress.com/2017/03/04/iptv-12-months-subscription-platinum-package-1-month-free-2devices-2/ \n\nvia WordPress https://buyiptvblog.wordpress.com/2017/03/04/iptv-12-months-subscription-platinum-package-1-month-free-2devices-6/ \n\nvia WordPress https://buyiptvblog.wordpress.com/2017/03/04/iptv-12-months-subscription-platinum-package-1-month-free-2devices-10/ \n\nvia WordPress https://buyiptvblog.wordpress.com/2017/03/04/iptv-12-months-subscription-platinum-package-1-month-free-2devices-24/ \n\nvia WordPress https://buyiptvblog.wordpress.com/2017/03/04/iptv-12-months-subscription-platinum-package-1-month-free-2devices-38/ ", "external_links": [], "published": "2017-03-04T19:30:00.000+02:00", "crawled": "2017-03-04T14:31:10.420+02:00", "highlightTitle": ""}